artist,image_url,website_url,wiki_url,wiki_extract
Rammstein,https://upload.wikimedia.org/wikipedia/commons/4/41/Rammstein_at_Wacken_Open_Air_2013_06.jpg,,https://en.wikipedia.org/wiki/Rammstein,"Rammstein is a German Neue Deutsche Härte band formed in Berlin in 1994. The band's lineup—consisting of lead vocalist Till Lindemann, lead guitarist Richard Kruspe, rhythm guitarist Paul Landers, bassist Oliver Riedel, drummer Christoph Schneider, and keyboardist Christian ""Flake"" Lorenz—has remained unchanged throughout their history, along with their approach to songwriting, which consists of L"
Red Hot Chili Peppers,https://upload.wikimedia.org/wikipedia/commons/1/14/RHCP_Live_in_London_26_June_2022.jpg,,https://en.wikipedia.org/wiki/Red_Hot_Chili_Peppers,"The Red Hot Chili Peppers are an American rock band formed in Los Angeles in 1982, consisting of Anthony Kiedis (vocals), Flea (bass), John Frusciante (guitar), and Chad Smith (drums). Their music incorporates elements of alternative rock, funk, punk rock, hard rock, hip hop, and psychedelic rock, and has influenced genres including funk metal, rap metal, rap rock, and nu metal. With over 120 mill"
Roger Waters,https://upload.wikimedia.org/wikipedia/commons/5/50/Roger_Waters_Newport_Folk_Festival_2015.jpg,,https://en.wikipedia.org/wiki/Roger_Waters,"George Roger Waters is an English singer-songwriter, musician and political activist. In 1965, he co-founded the rock band Pink Floyd as the bassist. Following the departure of the band's main songwriter Syd Barrett in 1968, Waters became Pink Floyd's principal lyricist, co-lead vocalist and conceptual leader until his departure in 1985."
Sessanta,https://upload.wikimedia.org/wikipedia/commons/thumb/5/5b/Primus_Concord%2C_Chicago_2014.jpg/3840px-Primus_Concord%2C_Chicago_2014.jpg,,https://en.wikipedia.org/wiki/Primus_(band),"Primus is an American rock band formed in El Sobrante, California in 1984. As of March 2025, the band is composed of bassist/vocalist Les Claypool, guitarist Larry ""Ler"" LaLonde, and drummer John ""Hoffer"" Hoffman. Primus originally formed in 1984 with Claypool and guitarist Todd Huth, later joined by drummer Jay Lane, though the latter two had departed by the beginning of the band's recording care"
Shinedown,https://upload.wikimedia.org/wikipedia/commons/9/9a/ShinedownThreatToSurvival.jpg,,https://en.wikipedia.org/wiki/Shinedown,"Shinedown is an American rock band from Jacksonville, Florida, formed by singer Brent Smith in 2001 after the dissolution of his previous band, Dreve. Smith, still under contract with record label Atlantic Records, recruited the band's original lineup of Jasin Todd as guitarist, Brad Stewart on bass, and Barry Kerch on drums. Consistent for the first two album cycles, several lineup changes follow"
Stone Temple Pilots,https://upload.wikimedia.org/wikipedia/commons/c/ce/Stone_Temple_Pilots_band_in_Manila.jpg,,https://en.wikipedia.org/wiki/Stone_Temple_Pilots,"Stone Temple Pilots, commonly abbreviated as STP, are an American rock band formed in San Diego, California, in 1989. Originally consisting of lead vocalist Scott Weiland, drummer Eric Kretz, and brothers Dean (guitar) and Robert DeLeo (bass), the band's lineup remained unchanged from its formation until the firing of Weiland in February 2013. Linkin Park vocalist Chester Bennington joined the ban"
System of a Down,https://upload.wikimedia.org/wikipedia/commons/b/b5/SOADJONESBEACH.jpg,,https://en.wikipedia.org/wiki/System_of_a_Down,"System of a Down is an Armenian-American heavy metal band formed in Glendale, California, in 1994. Since 1997, the band has consisted of founding members Serj Tankian, Daron Malakian, and Shavo Odadjian (bass); along with John Dolmayan (drums), who replaced original drummer Andy Khachaturian."
Tenacious D,https://upload.wikimedia.org/wikipedia/commons/4/45/TenaciousDO2160623_%2838_of_62%29_%28cropped%29.jpg,,https://en.wikipedia.org/wiki/Tenacious_D,Tenacious D is an American comedy rock band formed in Los Angeles in 1994 by Jack Black and Kyle Gass.
The Black Crowes,https://upload.wikimedia.org/wikipedia/commons/5/58/Black_crowes-Newport.jpg,,https://en.wikipedia.org/wiki/The_Black_Crowes,"The Black Crowes are an American rock band formed in Atlanta, Georgia, in 1984. Their discography includes ten studio albums, four live albums and several charting singles. The band was signed to Def American Recordings in 1989 by producer George Drakoulias and released their debut album, Shake Your Money Maker, the following year. Their follow-up, The Southern Harmony and Musical Companion, reach"
The Mars Volta,https://upload.wikimedia.org/wikipedia/commons/f/f6/The_Mars_Volta_NL_2023_%28cropped%29.jpg,,https://en.wikipedia.org/wiki/The_Mars_Volta,"The Mars Volta is an American progressive rock band formed in 2001. The band's only constant members are Omar Rodríguez-López and Cedric Bixler-Zavala, whose partnership forms the core of the band. The band's current line-up also includes founding member Eva Gardner (bass), Omar's brother Marcel Rodríguez-López, Leo Genovese and Linda-Philomène Tsoungui (drums)."
Tool,https://upload.wikimedia.org/wikipedia/commons/4/44/Tool_live_Birmingham_2022.jpg,,https://en.wikipedia.org/wiki/Tool_(band),"Tool is an American rock band formed in Los Angeles in 1990. The group consists of vocalist Maynard James Keenan, guitarist Adam Jones, drummer Danny Carey and bassist Justin Chancellor, who replaced founding member Paul D'Amour in 1995. Tool has won four Grammy Awards, performed worldwide tours, and produced albums topping charts in several countries."
U2,https://upload.wikimedia.org/wikipedia/commons/thumb/a/ac/U2_on_Joshua_Tree_Tour_2017_Brussels_8-1-17.jpg/3840px-U2_on_Joshua_Tree_Tour_2017_Brussels_8-1-17.jpg,,https://en.wikipedia.org/wiki/U2,"U2 are an Irish rock band formed in Dublin in 1976. The group comprises Bono, the Edge, Adam Clayton, and Larry Mullen Jr.. Initially rooted in post-punk, U2's musical style has evolved throughout their career, yet has maintained an anthemic quality built on Bono's expressive vocals and the Edge's chiming, effects-based guitar sounds. Bono's lyrics, often embellished with spiritual imagery, focus"
Weird Al,https://upload.wikimedia.org/wikipedia/commons/f/f8/Weird_Al_Yankovic_Photo_Op_GalaxyCon_Richmond_2025_%28portrait%29.jpg,,https://en.wikipedia.org/wiki/%22Weird_Al%22_Yankovic,"Alfred Matthew ""Weird Al"" Yankovic is an American comedy musician, writer, and actor. He is best known for writing and performing comedy songs that often parody specific songs by contemporary musicians. He also performs original songs that are style pastiches of the work of other acts, as well as polka medleys of popular songs, most of which feature his trademark accordion. Since having one of his"
